{
  "schemaVersion": 1,
  "id": "clawboo",
  "name": "Clawboo Built-ins",
  "description": "The smallest pack that is still a pack: one agent, no teams, no skills.",
  "version": "1.0.0",
  "provenance": {
    "sourceId": "clawboo",
    "label": "Clawboo",
    "color": "#34D399",
    "license": "MIT",
    "adaptation": "original",
    "importedAt": "2026-08-25T00:00:00.000Z"
  },
  "counts": { "agents": 1, "teams": 0, "skills": 0 },
  "agents": [
    {
      "id": "clawboo-research-boo",
      "packId": "clawboo",
      "slug": "research-boo",
      "name": "Research Boo",
      "role": "Researcher",
      "emoji": "🔎",
      "color": "#3B82F6",
      "description": "Digs through sources and reports back.",
      "category": "research",
      "tags": ["research"],
      "skillIds": [],
      "body": "agents/clawboo-research-boo.json"
    }
  ],
  "teams": [],
  "skills": []
}
